{
  "$schema": "https://json-schema.org/draft/2020-12/schema",
  "$id": "https://vexil-lang.org/release/controls/expected-controls.json",
  "version": "1.0",
  "recordKind": "expected-external-controls",
  "scope": {"provider": "github", "repository": "vexil-lang/vexil"},
  "publicationPolicy": "Every critical assertion requires fresh authoritative provider evidence. Local repository declarations, green CI, and this expected-state record are not compliance evidence.",
  "assertions": [
    {"id": "EC-001", "authorityClass": "branch-protection", "provider": "github", "scope": "branch:main", "expectedState": "Pull requests and designated required checks are required; a sole-maintainer exception may set required approvals to zero while force push, deletion, and bypass remain denied.", "query": {"method": "GET", "path": "/repos/vexil-lang/vexil/branches/main/protection", "mode": "read-only"}, "severity": "critical", "owner": {"actorId": "github:furkanmamuk", "roleId": "repository-administrator", "assignmentId": "assignment-repository-administrator-2026-07-14"}, "freshness": "fresh-authoritative-observation-required", "publicationEffect": "unknown-or-noncompliant-blocks-manifest-approval-and-privileged-publication"},
    {"id": "EC-002", "authorityClass": "tag-protection", "provider": "github", "scope": "Canonical Tag namespaces", "expectedState": "Unauthorized creation and every update or deletion attempt are denied; Historical Tags remain untouched.", "query": {"method": "GET", "path": "/repos/vexil-lang/vexil/rulesets/19106890", "mode": "read-only"}, "severity": "critical", "owner": {"actorId": "github:furkanmamuk", "roleId": "repository-administrator", "assignmentId": "assignment-repository-administrator-2026-07-14"}, "freshness": "fresh-authoritative-observation-required", "publicationEffect": "unknown-or-noncompliant-blocks-manifest-approval-and-privileged-publication"},
    {"id": "EC-003", "authorityClass": "release-protection", "provider": "github", "scope": "future GitHub releases", "expectedState": "Future releases are immutable without rewriting any historical release or tag.", "query": {"method": "GET", "path": "/repos/vexil-lang/vexil/immutable-releases", "mode": "read-only"}, "severity": "critical", "owner": {"actorId": "github:furkanmamuk", "roleId": "repository-administrator", "assignmentId": "assignment-repository-administrator-2026-07-14"}, "freshness": "fresh-authoritative-observation-required", "publicationEffect": "unknown-or-noncompliant-blocks-manifest-approval-and-privileged-publication"},
    {"id": "EC-004", "authorityClass": "environment", "provider": "github", "scope": "target-isolated privileged environments", "expectedState": "Each privileged target has an isolated protected environment with reviewer, self-review, bypass, and wait controls observed. During the explicit sole-maintainer exception, self-review may remain enabled to avoid a deployment deadlock; this creates no independent review and does not lift any publication or continuity gate.", "query": {"method": "GET", "path": "/repos/vexil-lang/vexil/environments/{release-target}", "mode": "read-only"}, "severity": "critical", "owner": {"actorId": "github:furkanmamuk", "roleId": "repository-administrator", "assignmentId": "assignment-repository-administrator-2026-07-14"}, "freshness": "fresh-authoritative-observation-required", "publicationEffect": "unknown-or-noncompliant-blocks-manifest-approval-and-privileged-publication"},
    {"id": "EC-005", "authorityClass": "workflow-permission", "provider": "github", "scope": "Actions default workflow token permissions", "expectedState": "No implicit write-all default; advisory and rehearsal jobs lack privileged authority.", "query": {"method": "GET", "path": "/repos/vexil-lang/vexil/actions/permissions/workflow", "mode": "read-only"}, "severity": "critical", "owner": {"actorId": "github:furkanmamuk", "roleId": "repository-administrator", "assignmentId": "assignment-repository-administrator-2026-07-14"}, "freshness": "fresh-authoritative-observation-required", "publicationEffect": "unknown-or-noncompliant-blocks-manifest-approval-and-privileged-publication"},
    {"id": "EC-006", "authorityClass": "workflow-permission", "provider": "github", "scope": "privileged workflow jobs and third-party action pins", "expectedState": "Privileged jobs use minimum job permissions, deny untrusted fork code, and pin third-party Actions to full immutable commits.", "query": {"method": "GET", "path": "/repos/vexil-lang/vexil/actions/permissions", "mode": "read-only"}, "severity": "critical", "owner": {"actorId": "github:furkanmamuk", "roleId": "repository-administrator", "assignmentId": "assignment-repository-administrator-2026-07-14"}, "freshness": "fresh-authoritative-observation-required", "publicationEffect": "unknown-or-noncompliant-blocks-manifest-approval-and-privileged-publication"},
    {"id": "EC-007", "authorityClass": "identity-custody", "provider": "crates-io", "scope": "exact approved crates.io package identity", "expectedState": "Trusted publisher or approved narrow bootstrap binds the exact package, issuer, workflow, and environment.", "query": {"method": "GET", "path": "/api/v1/crates/{exact-approved-package}/owners", "mode": "read-only"}, "severity": "critical", "owner": {"actorId": "github:furkanmamuk", "roleId": "repository-administrator", "assignmentId": "assignment-repository-administrator-2026-07-14"}, "freshness": "fresh-authoritative-observation-required", "publicationEffect": "unknown-or-noncompliant-blocks-manifest-approval-and-privileged-publication"},
    {"id": "EC-008", "authorityClass": "identity-custody", "provider": "npm", "scope": "exact approved npm package identity", "expectedState": "Trusted publisher binds the exact package, repository, workflow, and protected environment with no cross-target credential.", "query": {"method": "GET", "path": "/-/npm/v1/security/trusted-publisher/{exact-approved-package}", "mode": "read-only"}, "severity": "critical", "owner": {"actorId": "github:furkanmamuk", "roleId": "repository-administrator", "assignmentId": "assignment-repository-administrator-2026-07-14"}, "freshness": "fresh-authoritative-observation-required", "publicationEffect": "unknown-or-noncompliant-blocks-manifest-approval-and-privileged-publication"},
    {"id": "EC-009", "authorityClass": "identity-custody", "provider": "pypi", "scope": "exact approved PyPI project identity", "expectedState": "Authoritative project ownership and trusted publisher binding are confirmed before any Python target can be included later.", "query": {"method": "GET", "path": "/pypi/{exact-approved-project}/json", "mode": "read-only"}, "severity": "critical", "owner": {"actorId": "github:furkanmamuk", "roleId": "repository-administrator", "assignmentId": "assignment-repository-administrator-2026-07-14"}, "freshness": "fresh-authoritative-observation-required", "publicationEffect": "unknown-or-noncompliant-blocks-manifest-approval-and-privileged-publication"},
    {"id": "EC-010", "authorityClass": "revocation", "provider": "github", "scope": "provider-backed revocation paths", "expectedState": "A safe, target-scoped non-production or reviewed reversible revocation path proves denial and recovery without a production release effect.", "query": {"method": "GET", "path": "/repos/vexil-lang/vexil/environments", "mode": "read-only"}, "severity": "critical", "owner": {"actorId": "github:furkanmamuk", "roleId": "repository-administrator", "assignmentId": "assignment-repository-administrator-2026-07-14"}, "freshness": "fresh-authoritative-observation-required", "publicationEffect": "unknown-or-noncompliant-blocks-manifest-approval-and-privileged-publication"}
  ]
}
